{
  "artifact_kind": "provenance_check",
  "artifact_version": "1.0",
  "catalog_commit": "7512fbf179925eeb015e320e35004d16a95050e8",
  "evidence": {
    "artifact_paths": [
      "result.json",
      "transcript.txt"
    ],
    "citations_or_paths": [
      ".agents/skills/context-budget/SKILL.md",
      "included/skills/by-category/devops-cloud-operations/selected-project-reference/strmt7-simple-ai-bitcoin-trading-binance-agents-skills-context-budget/SKILL.md",
      "AGENTS.md"
    ]
  },
  "execution": {
    "commands_or_transcript_path": "transcript.txt",
    "fresh_session": true
  },
  "independence": {
    "evaluator_defined_outside_skill": true,
    "expected_result_defined_outside_skill": false,
    "skill_content_usage": "source text used only for provenance and activation extraction; this artifact is not a counted runtime benchmark pass",
    "task_defined_outside_skill": false,
    "uses_exact_skill_content_for_expected_result": true
  },
  "input_snapshot": {
    "identifier": "https://github.com/strmt7/simple_ai_bitcoin_trading_binance/blob/451d77df90621e3b666581d9835d246fb7147349/.agents/skills/context-budget/SKILL.md",
    "is_real": true,
    "kind": "source-skill-repository",
    "mirrored_path": "included/skills/by-category/devops-cloud-operations/selected-project-reference/strmt7-simple-ai-bitcoin-trading-binance-agents-skills-context-budget",
    "skill_file_sha256": "ae259dc7adb506e068e2361bb724e9bb603c3c9eed0d777b0e9cceb451777da4",
    "source_commit": "451d77df90621e3b666581d9835d246fb7147349"
  },
  "metrics": {
    "activation_condition_count": 1,
    "observed_heading_count": 5,
    "proof_evidence_count": 3,
    "source_line_count": 25,
    "workflow_step_count": 4
  },
  "objective_checks": [
    "frontmatter or fallback source structure used",
    "source citations present",
    "no unsupported capability claims"
  ],
  "outputs": {
    "path": "result.json",
    "result_sha256": "640b74d5b1942d977315762c5f6a09e4a82253bb165c8928eb95ef0eca26d520",
    "schema": "evaluators/source_grounded_skill_proof.schema.json"
  },
  "runner": {
    "batch_name": "2026-04-17-first-source-proofs",
    "model_or_runtime": "local-deterministic-source-proof-runner",
    "timestamp_utc": "2026-04-17T19:10:10Z",
    "tool": "tools/create_source_proof_batch.py"
  },
  "scenario_id": "skill-proof-strmt7-simple-ai-bitcoin-trading-binance-agents-skills-context-budget-skill-md",
  "scenario_requirements": {
    "context_memory": false,
    "token_efficiency_claim": false,
    "visual_or_browser": false
  },
  "skill_id": "strmt7-simple-ai-bitcoin-trading-binance-agents-skills-context-budget-skill-md",
  "source_commit": "451d77df90621e3b666581d9835d246fb7147349",
  "source_path": ".agents/skills/context-budget/SKILL.md",
  "source_repo": "strmt7/simple_ai_bitcoin_trading_binance"
}
