{
  "artifact_kind": "provenance_check",
  "artifact_version": "1.0",
  "catalog_commit": "515e8b9056ae5cf4a1d8ee3f5d64d1f3c729b375",
  "evidence": {
    "artifact_paths": [
      "result.json",
      "transcript.txt"
    ],
    "citations_or_paths": [
      "packages/cli/skills/claude-md-generator/SKILL.md",
      "included/skills/by-category/coding-refactoring-repository-automation/reddit-verified-gtm-registry/claude-md-generator/SKILL.md",
      "AGENTS.md"
    ]
  },
  "execution": {
    "commands_or_transcript_path": "transcript.txt",
    "fresh_session": true
  },
  "independence": {
    "evaluator_defined_outside_skill": true,
    "expected_result_defined_outside_skill": false,
    "skill_content_usage": "source text used only for provenance and activation extraction; this artifact is not a counted runtime benchmark pass",
    "task_defined_outside_skill": false,
    "uses_exact_skill_content_for_expected_result": true
  },
  "input_snapshot": {
    "identifier": "https://github.com/Varnan-Tech/opendirectory/blob/bc01f7c1c31f0af54c2924c1ec1abbb472ab1df4/packages/cli/skills/claude-md-generator/SKILL.md",
    "is_real": true,
    "kind": "source-skill-repository",
    "mirrored_path": "included/skills/by-category/coding-refactoring-repository-automation/reddit-verified-gtm-registry/claude-md-generator",
    "skill_file_sha256": "73f8d92940af2bbd5aae9777d692c9cd1ac7eba11d9bb585d241c52ad6397ff5",
    "source_commit": "bc01f7c1c31f0af54c2924c1ec1abbb472ab1df4"
  },
  "metrics": {
    "activation_condition_count": 1,
    "observed_heading_count": 8,
    "proof_evidence_count": 3,
    "source_line_count": 251,
    "workflow_step_count": 4
  },
  "objective_checks": [
    "frontmatter or fallback source structure used",
    "source citations present",
    "no unsupported capability claims"
  ],
  "outputs": {
    "path": "result.json",
    "result_sha256": "15293afb99bd863879c8902deb44bf9539ef5cdd3081a743772ef4b09c6b5e88",
    "schema": "evaluators/source_grounded_skill_proof.schema.json"
  },
  "runner": {
    "batch_name": "2026-04-17-first-source-proofs",
    "model_or_runtime": "local-deterministic-source-proof-runner",
    "timestamp_utc": "2026-04-17T21:39:52Z",
    "tool": "tools/create_source_proof_batch.py"
  },
  "scenario_id": "skill-proof-varnan-tech-opendirectory-packages-cli-skills-claude-md-generator-skill-md",
  "scenario_requirements": {
    "context_memory": false,
    "token_efficiency_claim": false,
    "visual_or_browser": false
  },
  "skill_id": "varnan-tech-opendirectory-packages-cli-skills-claude-md-generator-skill-md",
  "source_commit": "bc01f7c1c31f0af54c2924c1ec1abbb472ab1df4",
  "source_path": "packages/cli/skills/claude-md-generator/SKILL.md",
  "source_repo": "Varnan-Tech/opendirectory"
}
