{
  "artifact_kind": "independent_benchmark",
  "artifact_version": "1.0",
  "catalog_commit": "8e3e1077c5dd0d16334f25cdddbc01e658b2f353",
  "evidence": {
    "artifact_paths": [
      "result.json",
      "transcript.txt",
      "dataset_snapshot.json",
      "benchmarks/independent-runtime-readiness/batch-01/tasks.json"
    ],
    "citations_or_paths": [
      "benchmarks/independent-runtime-readiness/batch-01/tasks.json",
      "included/skills/by-category/testing-qa-benchmarking/selected-project-reference/strmt7-simple-ai-bitcoin-trading-binance-agents-skills-verification-loop/SKILL.md",
      "included/agent-ready/by-category/testing-qa-benchmarking/selected-project-reference/strmt7-simple-ai-bitcoin-trading-binance-agents-skills-verification-loop/SKILL.md",
      "data/benchmark_scenarios.json",
      "data/benchmark_tracks.json",
      "data/skill_risk_audit.json",
      "https://github.com/SWE-bench/SWE-bench"
    ]
  },
  "execution": {
    "commands_or_transcript_path": "transcript.txt",
    "fresh_session": true
  },
  "independence": {
    "evaluator_defined_outside_skill": true,
    "expected_result_defined_outside_skill": true,
    "skill_content_usage": "skill text was read only as the object under test for package loadability, frontmatter, hash, and local-link checks; task and expected results came from benchmarks/independent-runtime-readiness/batch-01/tasks.json and this runner",
    "task_defined_outside_skill": true,
    "uses_exact_skill_content_for_expected_result": false
  },
  "input_snapshot": {
    "dataset_track_id": "swe-bench-lite",
    "dataset_url": "https://github.com/SWE-bench/SWE-bench",
    "identifier": "https://github.com/SWE-bench/SWE-bench",
    "is_real": true,
    "kind": "real-github-repository-tree",
    "mirrored_path": "included/skills/by-category/testing-qa-benchmarking/selected-project-reference/strmt7-simple-ai-bitcoin-trading-binance-agents-skills-verification-loop",
    "resolved_commit": "f7bbbb2ccdf479001d6467c9e34af59e44a840f9",
    "track_subpath": null,
    "track_subpath_present": true,
    "tree_path_count": 1206
  },
  "metrics": {
    "benchmark_verdict": "failed",
    "blocking_failure_count": 1,
    "checks_passed": 9,
    "checks_total": 10,
    "dataset_tree_path_count": 1206,
    "missing_local_link_count": 0,
    "score_percent": 90.0
  },
  "objective_checks": [
    "real_dataset_snapshot_resolved",
    "assigned_non_provenance_scenario",
    "independent_task_brief_present",
    "mirror_skill_file_exists",
    "agent_ready_entrypoint_exists",
    "source_hash_matches_catalog",
    "required_frontmatter_present",
    "local_markdown_links_resolve",
    "single_session_entrypoint_clean",
    "generic_workflow_schema_recorded"
  ],
  "outputs": {
    "path": "result.json",
    "result_sha256": "4451c709d68fb866757d34f080a1416de6fdbf885da96de4daa1f31fa86b2962",
    "schema": "evaluators/generic_workflow_result.schema.json"
  },
  "runner": {
    "batch_name": "2026-04-17-independent-runtime-readiness-batch-01",
    "model_or_runtime": "local-deterministic-runtime-readiness-runner",
    "timestamp_utc": "2026-04-17T20:35:46Z",
    "tool": "tools/create_independent_runtime_batch.py"
  },
  "scenario_id": "testing-qa-and-benchmarking-swe-bench-lite",
  "scenario_requirements": {
    "context_memory": false,
    "dataset_track_id": "swe-bench-lite",
    "real_repository_workflow": true,
    "token_efficiency_claim": false,
    "visual_or_browser": false
  },
  "skill_id": "strmt7-simple-ai-bitcoin-trading-binance-agents-skills-verification-loop-skill-md",
  "source_commit": "451d77df90621e3b666581d9835d246fb7147349",
  "source_path": ".agents/skills/verification-loop/SKILL.md",
  "source_repo": "strmt7/simple_ai_bitcoin_trading_binance"
}
