{
  "artifact_kind": "provenance_check",
  "artifact_version": "1.0",
  "catalog_commit": "7512fbf179925eeb015e320e35004d16a95050e8",
  "evidence": {
    "artifact_paths": [
      "result.json",
      "transcript.txt"
    ],
    "citations_or_paths": [
      ".agents/skills/ai-regression-testing/SKILL.md",
      "included/skills/by-category/science-research-data-analysis/selected-project-reference/strmt7-ome-zarr-c-agents-skills-ai-regression-testing/SKILL.md",
      "AGENTS.md"
    ]
  },
  "execution": {
    "commands_or_transcript_path": "transcript.txt",
    "fresh_session": true
  },
  "independence": {
    "evaluator_defined_outside_skill": true,
    "expected_result_defined_outside_skill": false,
    "skill_content_usage": "source text used only for provenance and activation extraction; this artifact is not a counted runtime benchmark pass",
    "task_defined_outside_skill": false,
    "uses_exact_skill_content_for_expected_result": true
  },
  "input_snapshot": {
    "identifier": "https://github.com/strmt7/ome-zarr-C/blob/a9238a81742f96c89acf6d83fce6d6b882ac4d1c/.agents/skills/ai-regression-testing/SKILL.md",
    "is_real": true,
    "kind": "source-skill-repository",
    "mirrored_path": "included/skills/by-category/science-research-data-analysis/selected-project-reference/strmt7-ome-zarr-c-agents-skills-ai-regression-testing",
    "skill_file_sha256": "cd08927aebc6b000df78ea0845d3adafa60bd64ae52c7f2fabe64f72f7e8041f",
    "source_commit": "a9238a81742f96c89acf6d83fce6d6b882ac4d1c"
  },
  "metrics": {
    "activation_condition_count": 1,
    "observed_heading_count": 2,
    "proof_evidence_count": 3,
    "source_line_count": 18,
    "workflow_step_count": 4
  },
  "objective_checks": [
    "frontmatter or fallback source structure used",
    "source citations present",
    "no unsupported capability claims"
  ],
  "outputs": {
    "path": "result.json",
    "result_sha256": "36ff6fa8d2bbfcbfde188531881eaeadd66487f2f3117420d91bb729dbbe26cb",
    "schema": "evaluators/source_grounded_skill_proof.schema.json"
  },
  "runner": {
    "batch_name": "2026-04-17-first-source-proofs",
    "model_or_runtime": "local-deterministic-source-proof-runner",
    "timestamp_utc": "2026-04-17T19:10:10Z",
    "tool": "tools/create_source_proof_batch.py"
  },
  "scenario_id": "skill-proof-strmt7-ome-zarr-c-agents-skills-ai-regression-testing-skill-md",
  "scenario_requirements": {
    "context_memory": false,
    "token_efficiency_claim": false,
    "visual_or_browser": false
  },
  "skill_id": "strmt7-ome-zarr-c-agents-skills-ai-regression-testing-skill-md",
  "source_commit": "a9238a81742f96c89acf6d83fce6d6b882ac4d1c",
  "source_path": ".agents/skills/ai-regression-testing/SKILL.md",
  "source_repo": "strmt7/ome-zarr-C"
}
